{
  "$schema": "https://json-schema.org/draft/2020-12/schema",
  "$id": "https://patchmesh.dev/schemas/phase0/v1/task-validity.schema.json",
  "$defs": {
    "state": { "enum": ["unassessed", "valid", "possibly_stale", "revalidating", "stale"] },
    "transition": { "type": "object", "properties": { "from": { "$ref": "#/$defs/state" }, "to": { "$ref": "#/$defs/state" }, "reason": { "enum": ["validation_passed", "dependency_impact", "validation_started", "validation_failed", "deterministic_proof", "validation_inconclusive", "validation_interrupted", "target_superseded"] }, "targetSnapshotId": { "$ref": "./identities.schema.json#/$defs/targetSnapshotId" }, "evidenceEventIds": { "type": "array", "items": { "$ref": "./identities.schema.json#/$defs/eventId" }, "minItems": 1, "uniqueItems": true } }, "required": ["from", "to", "reason", "targetSnapshotId", "evidenceEventIds"], "additionalProperties": false },
    "validation": { "type": "object", "properties": { "command": { "type": "string", "pattern": "^\\S(?:.*\\S)?$" }, "outcome": { "enum": ["started", "passed", "failed", "inconclusive", "interrupted"] }, "targetSnapshotId": { "$ref": "./identities.schema.json#/$defs/targetSnapshotId" }, "resultEventId": { "$ref": "./identities.schema.json#/$defs/eventId" } }, "required": ["command", "outcome", "targetSnapshotId", "resultEventId"], "additionalProperties": false }
  },
  "type": "object", "properties": {
    "validityId": { "type": "string", "pattern": "^validity_[0-9a-f]{32}$" }, "taskId": { "type": "string", "pattern": "^task_[a-z0-9][a-z0-9._-]{0,63}$" }, "workProductId": { "type": "string", "pattern": "^work_[0-9a-f]{32}$" }, "executionState": { "enum": ["completed", "failed", "cancelled"] }, "validityState": { "$ref": "#/$defs/state" }, "baseRevision": { "type": "string", "pattern": "^[0-9a-f]{40}([0-9a-f]{24})?$" }, "targetSnapshotId": { "$ref": "./identities.schema.json#/$defs/targetSnapshotId" }, "observedDependencies": { "type": "array", "items": { "$ref": "./identities.schema.json#/$defs/resourceVersion" }, "uniqueItems": true }, "validations": { "type": "array", "items": { "$ref": "#/$defs/validation" } }, "coverageIds": { "type": "array", "items": { "$ref": "./coverage.schema.json#/$defs/coverageId" }, "uniqueItems": true }, "evidenceEventIds": { "type": "array", "items": { "$ref": "./identities.schema.json#/$defs/eventId" }, "uniqueItems": true }, "lastTransition": { "oneOf": [{ "$ref": "#/$defs/transition" }, { "type": "null" }] }
  }, "required": ["validityId", "taskId", "workProductId", "executionState", "validityState", "baseRevision", "targetSnapshotId", "observedDependencies", "validations", "coverageIds", "evidenceEventIds", "lastTransition"], "additionalProperties": false
}
