[
  { "validityId": "validity_00000000000000000000000000000001", "taskId": "task_consumer", "workProductId": "work_00000000000000000000000000000001", "executionState": "completed", "validityState": "possibly_stale", "baseRevision": "1111111111111111111111111111111111111111", "targetSnapshotId": "snapshot_c618b284d547a3d866a9f42a3faa578f4feab8259437c376a5538dcd23562f88", "observedDependencies": [], "validations": [], "coverageIds": ["coverage_00000000000000000000000000000001"], "evidenceEventIds": ["evt_00000000000000000000000000000002", "evt_00000000000000000000000000000004", "evt_00000000000000000000000000000007", "evt_0000000000000000000000000000000b"], "lastTransition": { "from": "unassessed", "to": "possibly_stale", "reason": "dependency_impact", "targetSnapshotId": "snapshot_c618b284d547a3d866a9f42a3faa578f4feab8259437c376a5538dcd23562f88", "evidenceEventIds": ["evt_00000000000000000000000000000002", "evt_00000000000000000000000000000004", "evt_00000000000000000000000000000007"] } }
]
